cpc_code,description
G06V 20/69, not sure
#G16B 40/00,Machine Learning and AI in Biology/Bioinformatics
#G16B 15/00,Analyzing 2D/3D Molecular Structures (Cryo-EM Software/AI)
#G16B 20/00,Functional Genomics and Proteomics (RNA-Seq pipelines)
#G16H 50/20,Computer-Aided Medical Diagnosis (AI Embryo selection)
#C12M 3/00,Tissue and Cell Culture Apparatus (IVF Microfluidics)
#H01J 37/26,Electron or Ion Microscopes (Cryo-EM Hardware)
#G01N 21/00,Investigating Materials by Optical Means (Pooled Optical Screening)
